kroger_product,description,calories,protein,fat,carbohydrates
oroweat jewish rye bread,"jewish rye bread, jewish rye",281,9.38,4.69,53.1
pepperidge farm jewish pumpernickel dark pump bread,"pepperidge farm jewish pumpernickel dark pump bread, 16 oz. loaf",250,9.38,3.12,46.9
just bake it french batard white bread,french batard,228,7.02,1.75,45.6
pepperidge farm farmhouse homestyle oat bread,"pepperidge farm farmhouse homestyle oat bread, 24 oz loaf",265,8.16,4.08,51
pepperidge farm brown sugar cinnamon swirl breakfast bread,"pepperidge farm brown sugar cinnamon swirl breakfast bread, 16 oz loaf",289,10.5,5.26,55.3
bakery fresh goodness garlic bread half loaf,"bakery fresh goodness, pumpkin loaf cake",378,6.67,15.6,51.1
"pepperidge farm farmhouse brioche bread, 22 oz loaf","pepperidge farm farmhouse brioche bread, 22 oz loaf",289,13.3,4.44,48.9
la brea whole grain sliced bread,"whole grain la brea sliced loaf, whole grain",281,10.5,0.88,59.6
private selection® rustic ciabatta loaf artisan bread,"artisan ciabatta loaf bread, artisan ciabatta loaf",281,8.77,4.39,50.9
la brea bakery® sliced toasted sunflower honey bread,"toasted sunflower la brea sliced loaf, toasted sunflower",298,10.5,7.89,50.9
la brea bakery sliced french bread,"la brea bakery, sliced multigrain artisan sandwich bread",265,4.08,8.16,49
s. rosen's® party cocktail rye bread,"s. rosen's, rye bread",250,7.14,3.57,46.4
st pierre cinnamon brioche twist hand braided bread,"hand braided cinnamon brioche twist, cinnamon",300,6,9,44
bakery fresh goodness crusty white french bread,"bakery fresh goodness, white bread",280,8,4,56
d'italiano italian bread,"bread, italian",1014.0000000000008,9.49,2.73,48.1
kroger® cheesy garlic pull apart bread,"cheesy garlic pull-apart rolls, cheesy garlic",324,8.82,16.2,36.8
king's hawaiian round sweet bread,"round hawaiian sweet bread, hawaiian sweet",298,8.77,7.02,52.6
la brea bakery white sourdough bread,"la brea bakery, sliced white artisan sandwich bread",265,2.04,6.12,53.1
private selection® cranberry walnut loaf artisan bread,"private selection, multi multigrain loaf bread",246,8.77,3.51,43.9
wholesome harvest® blueberry & oat sliced bread,wholesome harvest bread,404,12.3,7.89,52.74000000000001
italian bread everything topped,"everything italian bread, everything italian",232,8.93,2.68,44.6
la brea bakery whole grain bread half loaf,"la brea bakery, garlic loaf",263,8.77,0.88,52.6
wholesome harvest whole wheat sliced sandwich bread,"wholesome harvest, stone ground whole wheat bread",228,10.5,3.51,40.4
pillsbury apple cinnamon bread batter,pillsbury apple cinnamon bread batter,362,3.18,14.5,54.6
bakery fresh sliced pumpernickel rye bread,"bread, marble rye and pumpernickel",259,8.5,3.3,48.3
bakery fresh everything french bread,everything french bread,226,9.43,1.89,45.3
mestemacher bread - 17.6 oz - case of 12,"lior buckwheat, 17.6 oz",92,2.98,0.6,19.6
the essential baking company - take & bake italian bread - case of 16 - 16 oz.,"the essential baking company, organic olive bread",200,6,2,40
mestemacher 17.6 oz organic three grain bread set of 3,"mestemacher, organic flax seed + chia bread",200,4.29,3.57,30
simple kneads bread sourdough,"bread, french or vienna (includes sourdough)",1014.0000000000008,10.8,2.42,51.9
larabar 1.6 oz banana bread,larabar banana bread fruit & nut bar,451,10.2,21.6,54
"king's hawaiian original hawaiian bread, 16 ounce (pack of 12)","hawaiian bread, hawaiian",275,10,5,45
mestemacher rustic sunflower seed bread,"sunflower seeds, flavored",567,18.45,32.1,25.92
essential baking company - take & bake sourdough bread 16 oz,take & bake sourdough loaf,232,7.14,0.89,46.4
picos bread sticks picos camperos by mas aliu 6.35 oz pack of 3,picos camperos mini olive oil breadsticks,433,13.3,10,52.74000000000001
the essential baking company - bread take & bake french - case of 16 - 16 oz,"french organic take & bake bread, french",250,7.14,0.89,51.8
mestemacher rustic three grain bread,"three grain bread, three grain",176,7.35,2.94,35.3
korn's pumpernickle rye bread,"pumpernickle & rye roll, pumpernickle & rye",306,8.33,5.56,52.8
b&m brown bread original,"bread, boston brown",274,10.67,4.53,47.54
bauducco 5.01 oz original toasted bread,"bauducco, original toast, original, original",389,11.1,9.26,52.74000000000001
"hero seeded bread low carb & keto friendly bread loaf 15 slices loaf, 2 loaves","seeded keto loaf, seeded",179,28.6,3.57,46.4
the essential baking company - bake at home rosemary bread - case of 16 - 16 oz,"the essential baking company, organic sliced rosemary",236,7.27,4.55,41.8
broadman church supplies communion bread,favorites emergency food supply,362,15.9,5.8,52.74000000000001
thomas' original english muffins,"george weston bakeries, thomas english muffins",972,8,1.8,46
entenmann's little bites chocolate chip mini muffins,"muffin, chocolate chip",402,5.77,19.04,55.4
edward & sons baked whole grain brown rice snaps® onion garlic - 3.5 oz (100 g),"edward & sons, baked brown rice snaps, onion garlic, onion garlic",333,6.67,6.67,52.74000000000001
5 oz delicious whole wheat toast,"bread, whole wheat, toasted",279,13.52,3.9,47.36
dave's killer bread epic everything organic bagels,epic everything organic bagels,274,13.7,5.26,46.3
dave's killer bread® plain awesome® bagels organic bagels,plain awesome organic bagels,274,11.6,3.16,50.5
dave's killer bread cinnamon raisin remix bagels organic bagels,"organic bagels, cinnamon raisin remix",263,11.6,2.63,51.6
"dave’s killer bread® boomin’ berry® bagels, cranberry, blueberry, blackberry and acai bagels","organic bagels, boomin' berry",274,11.6,2.63,50.5
dave's killer bread killer classic english muffins organic english muffins,"killer classic organic english muffins, killer classic",226,9.68,1.61,43.6
dave's killer bread® burgers done right™ organic white bread hamburger buns,"organic white bread done right, white",286,10.7,5.36,53.6
schar gluten free sandwich roll,"schar, gluten-free, classic white rolls",239,3.34,2.65,50.5
greens cinnamon babka - pack of 3,"babka, cinnamon",354,3.03,13.1,56.6
oroweat 100% whole wheat sandwich thins,"100% whole wheat sandwich thins rolls, 100% whole wheat",233,11.6,2.33,51.2
private selection® ciabatta baguette artisan bread,"ciabatta artisan bread, ciabatta",246,8.77,0.88,47.4
joseph's™ original pita bread 1 pack of 4,"bread, pita",275,9.1,1.2,55.7
private selection® french demi baguette artisan bread,"french demi artisan baguette, french demi",263,8.77,0.88,52.6
joseph's™ flax oat whole wheat pita bread,"bread, pita, whole wheat",262,9.8,1.71,55.89
private selection® challah bread,"bread, egg, challah",287,9.5,6,47.8
kroger® frozen bread dough,"bread, dough, fried",384,9.36,18.84,44.97
"wonder bread dinner rolls, soft white bread rolls, 12 count",soft dinner breads rolls,310,9.52,7.14,52.4
canyon bakehouse honey whole grain gluten free english muffins fresh,"english muffins, whole grain white",1014.0000000000008,7.02,1.75,50.2
oroweat multigrain sandwich thins,"multigrain sandwich thins rolls, multigrain",263,10.5,3.51,49.1
schar - ciabatta multigrain,"multigrain ciabatta roll square, multigrain ciabatta",280,9,3,54
new york bakery frozen garlic breadsticks,"breadsticks, soft, frozen",313,11.09,9.16,46.37
new york bakery breadsticks with real garlic,"pizza hut, breadstick, parmesan garlic",1014.0000000000008,12.2,12.9,44.5
kroger® pull aparts 6 cheese & garlic breadsticks,pull apart garlic loaf with real cheese,364,10.9,16.4,41.8
kroger® garlic frozen texas toast,"kroger, garlic texas toast",360,6,20,38
king's hawaiian® savory butter dinner rolls,"king's hawaiian, savory butter rolls",357,10.7,8.93,57.1
king's hawaiian original hawaiian sweet dinner rolls party pack,"sweet hawaiian dinner rolls, sweet hawaiian",289,10.5,3.95,50
new york bakery garlic frozen texas toast,"new york bakery, texas toast",500,10,23.3,60
sister schubert's frozen dinner yeast rolls,"yeast dinner rolls, yeast",326,6.98,5.81,58.1
la brea bakery take & bake twin pack french baguette,"twin french organic take & bake baguettes, twin french",246,8.2,0.82,49.2
st pierre® sliced brioche loaf,"brioche sliced loaf, brioche",333,9.09,9.09,54.6
backerhaus veit signature multigrain loaf,"signature multigrain loaf, signature multigrain",286,10.7,6.25,46.4
la brea bakery take & bake french dinner rolls,"la brea bakery, telera rolls",282,9.41,1.76,55.3
wholesome harvest 9-grain & seed loaf,"wholesome harvest, 9 grain & seed loaf",281,8.77,6.14,47.4
impossible™ plant-based beef,"impossible beef made from plants ravioli, beef",250,12,6.48,34.3
beyond meat® beyond® breakfast sausage™ spicy plant-based patties,"spicy beyond breakfast sausage plant-based patties, spicy",310,19,20.7,10.3
beyond meat beyond chicken® plant-based breaded tenders,"original beyond chicken tenders plant-based breaded tenders, original",262,16.2,15,18.8
beyond meat® cookout classic™ plant-based burger patties,cookout classic plant-based burger patties,257,15.9,19.5,3.54
kroger® original breakfast sausage links,"sausage, turkey, breakfast links, mild, raw",728,15.9,10.4,3.18
kroger® chicken fries,"rice, fried, with chicken",173,7.28,3.66,27.62
hillshire farm ultra thin sliced black forest ham deli lunch meat,"uncured black forest ham ultra-thin deli slices, uncured black forest",107,16.1,3.57,1.79
boar's head tavern ham fresh sliced deli meat,"ham, prepackaged or deli, luncheon meat",101,16.7,3.73,0.27
beyond meat beyond steak® plant-based seared tips,"original beyond steak plant-based seared tips, original",193,23.9,6.82,7.95
land o' frost® premium old world style black forest ham lunch meat,"old world style black forest ham, old world style",120,16,4,2
hillshire farm ultra thin sliced honey ham sandwich meat,honey ham ultra thin sliced,125,16.1,2.68,8.93
oscar mayer deli fresh honey smoked deli turkey breast sliced lunch meat,"oscar mayer, deli fresh, blackened turkey breast",107,16.1,2.68,3.57
oscar mayer deli fresh oven roasted deli turkey breast sliced lunch meat,deli fresh oven roasted sliced lunch meat turkey breast,89,16.1,1.79,3.57
classic bologna sliced deli-style lunch meat,bryan deli classics bologna deli sliced lunch meat,329,11,29,6
oscar mayer deli fresh rotisserie seasoned chicken breast deli lunch meat,"chicken breast, deli, rotisserie seasoned, sliced, prepackaged",98,17.4,1.86,2.92
oscar mayer deli fresh uncured honey ham sliced deli meat,deli fresh honey sliced lunch meat uncured ham,125,21.4,2.68,3.57
hillshire farm ultra thin sliced oven roasted turkey breast sandwich meat,"oven roasted turkey breast ultra-thin deli slices, oven roasted",107,16.1,1.79,3.57
beyond meat beyond meatballs® italian style plant-based meatballs,"italian style beyond meatballs plant-based meatballs, italian style",240,15.7,17.4,7.44
kroger® mild italian ground sausage,"kroger, italian sausage, mild, mild",308,18,23.1,6.41
smithfield roasted garlic & herb pork loin filet,"pork loin filet, garlic & herb",107,17.9,2.23,1.79
unmeat meat-free chicken chunks 6.35 oz,"eurovafel eurocrem wafer, 6.35 oz",502,7,26,60
la herencia® carne asada boneless beef loin flap meat steak,"boneless beef loin flap meat steak for carne asada, boneless beef",152,16.1,8.93,1.79
buddig beef lunch meat 2oz,"pasta with sauce and meat, from school lunch",117,5.95,3.12,17.5
tyson frozen crispy chicken breast strips,"kfc, crispy chicken strips",274,20.2,15.4,13.7
kroger® crunchy butterfly shrimp,"crunchy butterfly shrimp, crunchy butterfly",306,10.6,14.1,22.4
beef choice cubed beef for stew,"stew, beef",107,8.76,5.07,6.29
simple truth™ natural lamb for stew meat,"stew, lamb",117,8.19,6.39,6.29
beyond meat stack burger™ plant-based patties,beyond burger plant-based patties,204,17.7,12.4,6.19
kroger® three meat crispy crust personal frozen pizza,"three meat crispy crust pizza, three meat",252,7.48,10.2,32
hillshire farm ultra thin sliced honey roasted turkey breast sandwich meat,hillshire farm sliced turkey breast,96.2,15.4,1.98,4.19
land o' frost® premium honey ham lunch meat,"cereal, o's, honey nut",385,8.62,5.37,52.74000000000001
oscar mayer carving board slow cooked sliced ham deli lunch meat,"oscar mayer, ham (chopped with natural juice)",754,16.3,11.2,3.65
oscar mayer cotto salami sliced lunch meat,"oscar mayer, cotto salami",250,14.3,21.4,3.57
oscar mayer deli fresh slow roasted roast beef sliced deli meat,"oscar mayer, slow roasted beef",107,17.9,3.57,1.79
oscar mayer thick cut bologna sliced lunch meat,"oscar mayer, thick cut bologna",302,11.6,25.6,4.65
oscar mayer carving board oven roasted deli turkey lunch meat,carving board oven roasted turkey breast,107,21.4,1.79,1.79
land o' frost premium honey smoked turkey breast lunch meat,"land o'frost, premium, hickory smoked turkey breast",180,16,10,6
oscar mayer deli fresh oven roasted turkey & smoked ham sliced deli lunch meats variety pack,"oscar mayer deli fresh oven roasted turkey breast and smoked uncured ham, 9 oz",107,17.9,1.79,3.57
buddig honey roasted turkey lunch meat 2oz,"turkey, whole, dark meat, meat and skin, cooked, roasted",206,27.3,9.95,0.07
buddig honey ham lunch meat 2oz,"buddig, original honey ham",164,16.4,9.09,3.64
hillshire farm® ultra thin sliced roast beef lunch meat,"roast beef ultra-thin deli slices, roast beef",143,19.6,6.25,1.79
hillshire farm ultra thin sliced smoked ham sandwich meat,"hillshire farm, smoked ham",167,17.9,9.52,2.38
oscar mayer sub kit with smoked ham & smoked turkey breast sliced deli lunch meats variety pack,"oscar mayer, ham & turkey breast sub kit, honey smoked, honey smoked",105,14,3.51,7.02
oscar mayer lean oven roasted white turkey sliced lunch meat,"oscar mayer, braunschweiger liver sausage (sliced)",1014.0000000000008,14.2,29.4,2.6
hillshire farm ultra thin sliced brown sugar ham sandwich meat,"hillshire farm, deli select, ultra thin brown sugar ham",107,16.1,2.68,5.36
hillshire farm ultra thin sliced black forest ham sandwich meat,ultra thin slices black forest ham,109,18.2,1.82,1.82
oscar mayer ham & cheese meat loaf sliced deli lunch meat with real kraft cheese,meat loaf made with ham,179,20.65,7.52,6.16
buddig black forest ham lunch meat 2oz,"buddig, black forest ham",164,16.4,9.09,1.82
oscar mayer™ carving board applewood smoked turkey breast lunch meat,"oscar mayer, applewood smoked bacon",500,27.8,32.1,5.56
beyond meat beyond breakfast original plant-based sausage links,"brat original beyond sausage plant-based links, brat original",250,21,15.8,6.58
oscar mayer hard salami sliced lunch meat,"oscar mayer, salami (hard)",368,25.9,28.7,1.6
oscar mayer turkey bologna sliced lunch meat with 50% lower fat,"oscar mayer, bologna (beef)",316,11,29.1,2.45
petit jean ez carve boneless hickory smoked ham lunch meat,hickory smoked boneless ham,107,16.7,2.98,3.57
boar’s head sweet b’s honey barbeque glazed chicken breast,"oscar mayer, chicken breast (honey glazed)",109,19.8,1.5,4.3
just bare® lightly breaded chicken breast italian style strips,"italian style lightly breaded chicken breast strips, italian style",179,19,8.33,8.33
boar’s head maple glazed honey coat ham,maple glazed honey coat  ham,107,17.9,1.79,5.36
boar’s head smokemaster beechwood smoked black forest ham,smokemaster beechwood smoked black forest ham,107,17.9,1.79,3.57
boar’s head hard salami,"boar's head, hard salami",393,21.4,32.1,3.57
boar's head branded deluxe ham,boar's head branded deluxe ham,107,16.1,1.79,3.57
boar’s head top round pastrami,top round pastrami,143,23.2,5.36,1.79
boar’s head genoa salami,"brunckhorst's boars head genoa salami, 4 oz",339,21.4,26.8,1.79
kevin's natural foods thai-style coconut chicken,pad thai with chicken,154,8.13,7.5,14.36
kroger® roast beef traditional deli thin sliced,"roast beef, deli style, prepackaged, sliced",115,18.6,3.69,0.64
curly's hickory smoked & seasoned baby back pork ribs with barbecue sauce,hickory smoked & seasoned with barbecue sauce baby back pork ribs,238,14.3,14.3,14.3
wild planet albacore wild tuna,"albacore wild tuna, albacore",230,23,13.3,0.88
"impossible™ indulgent burger patties meat from plants, 2 ct","burger patties made from plants, burger",204,16.8,11.5,7.96
boar’s head first cut corned beef brisket,"beef, cured, corned beef, brisket, cooked",1014.0000000000008,18.2,19,0.47
just bare® lightly breaded frozen fully cooked chicken breast strips,"chicken tenders or strips, breaded, from frozen",240,14.62,13.58,14.86
just bare® lightly breaded frozen fully cooked spicy chicken breast bites,"lightly breaded chicken breast spicy bites, lightly breaded",190,19,8.33,11.9
applegate all natural gluten-free frozen chicken nuggets,all natural gluten free chicken nuggets,194,18.8,9.41,8.24
simple truth organic® frozen breaded homestyle chicken tenders,"chicken tenders, breaded, frozen, prepared",1000,14.6,13.6,14.9
applegate all natural frozen chicken nuggets,"chicken nuggets, from frozen",298,13.36,19.23,17.88
applegate all natural frozen breaded chicken patties,"chicken patty, breaded",287,14.85,19.58,12.84
perdue® simply smart® organics gluten-free chicken tenders,"perdue, simply smart, lightly breaded chicken nuggets",212,14.1,11.8,11.8
armour lunchmakers pepperoni pizza meal kit with candy bar,"armour, lunchmakers, pizza, pepperoni, pepperoni",165,3.5,5,27.5
beef choice for stir fry,"stir-fry beef strips, stir-fry beef",143,23.8,3.57,1.19
private selection® top sirloin angus beef steak,"denny's, top sirloin steak",182,28.9,7.34,0.14
private selection™ angus beef boneless ribeye steak,boneless angus beef ribeye steak,212,19.5,14.2,0.88
eat meati® mushroomroot™ classic steaks,"t.g.i. friday's, classic sirloin steak (10 oz)",196,31,7.83,0.47
eat meati™ classic cutlet,"cereal, ready-to-eat, nfs",379,7.74,4.01,52.74000000000001
yummy® meatless plant-based dino buddies® dinosaur-shaped vegan nuggets,"meatless breaded dinosaur-shaped plant-based protein nuggets, meatless",244,10.3,11.5,24.4
quorn™ meatless diced chiqin pieces,meatless chiqin wings,241,14.3,9.82,25
simple truth organic™ 100% grass-fed beef homestyle frozen meatballs,"organic grass fed beef meatballs, beef",247,16.5,16.5,7.06
quorn™ meatless grounds frozen meal,"pancakes and sausage, frozen meal",272,9,13.85,27.92
dr. praeger’s® meatless perfect burger®,"dr. praeger's, italian veggie burgers",167,5.13,7.69,19.2
quorn™ meatless nuggets,"bacon, meatless",1014.0000000000008,11.7,29.5,5.31
gardein® ultimate plant-based® meatalls,ultimate plant-based burger,186,17.7,9.73,6.19
simple truth organic™ grass-fed beef italian style frozen meatballs,"meatballs, frozen, italian style",286,14.4,22.2,8.06
private selection® oven roasted deli turkey breast sliced,"oven roasted deli selected turkey breast, oven roasted",89,16.1,1.79,3.57
private selection® wildflower honey deli ham sliced,"wildflower honey deli sliced ham, wildflower honey",136,18.6,4.24,6.78
private selection® wildflower honey deli turkey breast sliced,"wildflower honey deli sliced turkey breast, wildflower honey",102,18.6,0.85,5.08
private selection® prosciutto & mozzarella rolls,"prosciutto & mozzarella rolls, prosciutto & mozzarella",214,26.8,12.5,1.79
private selection® mesquite smoked deli turkey breast sliced,"mesquite smoked turkey breast deli slices, mesquite smoked",107,17.9,1.79,3.57
private selection® genoa salami deli sliced,"deli sliced genoa salami, deli",368,17.5,31.6,3.51
private selection® angus top round deli roast beef sliced,sliced angus seasoned roast beef top round,161,23.2,5.36,1.79
private selection® hard salami deli sliced,"hard salami deli slices, hard",400,20,32.1,3.33
private selection® brown sugar uncured deli ham sliced,"brown sugar sliced uncured ham, brown sugar",125,17.9,4.46,7.14
boar's head pepperoni,"boar's head, sandwich style pepperoni",464,21.4,32.1,3.57
private selection™ old world prosciutto,old world deli selection,321,25,25,3.57
private selection® pre-sliced genoa salami & provolone rolls,"uncured genoa salami & provolone cheese charcuterie rolls, uncured genoa salami & provolone cheese",353,23.5,26.5,2.94
private selection® cracked pepper deli turkey breast sliced,"cracked pepper deli sliced turkey breast, cracked pepper",102,17,0.85,3.39
columbus® sliced salame charcuterie trio,"columbus, peppered salame",321,21.4,25,7.14
private selection® pepperoni & mozzarella rolls,"pepperoni and mozzarella roll, pepperoni and mozzarella",298,26.3,21,1.75
morningstar farms® veggie breakfast original plant based sausage links,morningstar farms breakfast veggie sausage links 136oz 1ct,152,19.2,6.1,6.8
columbus® sliced italian dry salame,"columbus, lite italian dry salame",214,28.6,10.7,3.57
morningstar farms® veggie breakfast original plant based bacon strips,morningstar farms breakfast bacon 5.25oz,344,12.8,26.4,14.4
private selection® smokehouse tavern style off the bone deli ham sliced,"smokehouse deli sliced off the bone ham, smokehouse",119,17,4.24,1.69
morningstar farms® original plant based chik'n patties,plant-based crispy chik'n patties,225,14.1,9.86,21.1
morningstar farms® meal starters grillers plant based vegan crumbles,"morningstar farms veggie meal starters veggie grillers crumbles, 12 oz",115,17.3,3.85,7.69
morningstar farms® buffalo plant based chik'n patties,"plant-based buffalo chik'n pizza, buffalo chik'n",294,7.06,14.1,33.5
morningstar farms® veggie breakfast maple flavored plant based sausage patties,morningstar farms breakfast sausage patties,187,23.7,7,10.2
private selection® beef bologna uncured deli sliced,"bologna, beef",1014.0000000000008,10.9,26.1,4.29
morningstar farms® veggie breakfast hot and spicy plant based sausage patties,morningstar farms breakfast hot & spicy sausage patties 8oz,222,25.6,9.3,11.9
morningstar farms® spicy black bean plant based veggie burgers,morningstar farms veggie burgers spicy black bean 18.9oz,179,13.5,6.5,22.1
morningstar farms® grillers prime plant based veggie burgers,morningstar farms veggie burgers grillers prime,197,23,9.6,8.6
morningstar farms® grillers original plant based veggie burgers,morningstar farms veggie burgers grillers 18oz,213,23.9,9.3,8.5
private selection® bold & spicy pepperoni cracker cut,cracker cut  pepperoni,100,3.57,9.29,0.71
morningstar farms® garden veggie plant based veggie burgers,morningstar farms veggie burgers garden veggie 56oz,174,16.4,6.3,15.5
gardein ultimate plant-based chick'n tenders frozen vegan food,ultimate plant-based chick'n tenders,228,14.8,9.9,18.8
morningstar farms® original value pack plant based chik'n nuggets,"chik'n plant-based nuggets, chik'n",300,13.8,15,26.2
gardein ultimate plant-based chick'n filets,ultimate plant-based chick'n filets,218,15.5,9.15,19
impossible™ plant-based spicy chicken patties,"spicy enchilada bowl with impossible chicken made from plants, spicy enchilada with impossible chicken",133,4.31,4.71,19.2
gardein vegan frozen seven grain crispy plant-based chick'n tenders,"seven grain plant-based chick'n breaded with wholesome grains including oats, quinoa, and millet crispy tenders, seven grain",195,13,9.09,14.3
gardein ultimate plant-based ground be’f crumbles,"ground be'f ultimate plant-based crumbles, ground be'f",247,24.7,15,4.3
simple truth™ plant-based chorizo,"plant-based ""chorizo""",165,17.6,7.06,7.06
impossible™ wild nuggies™ plant-based chicken nuggets,plant-based chicken nuggets,238,17.5,11.2,18.8
boca all american veggie burgers,all american veggie burgers,212,24.8,9.73,6.19
gardein ultimate plant-based chick'n nuggets frozen vegan food,"ultimate plant-based chick'n nuggets, ultimate",202,14.9,8.51,17
gardein ultimate plant-based chick'n strips,"original ultimate plant-based chick'n strips, original",183,20.7,7.32,3.66
morningstar farms® original plant based veggie dogs,morningstar farms hot dogs veggie dogs 8.4oz,144,22,1.6,12.4
morningstar farms® sweet bbq plant based sauced riblets,morningstar farms meal solutions hickory bbq riblet 10oz,150,11.4,2.3,24.6
nasoya plantspired® plant-based korean bbq flavored steak,"korean bbq flavor plantspired plant-based steak, korean bbq",235,16.5,11.8,15.3
gardein® ultimate plant-based buffalo chick'n wings,"buffalo ultimate plant-based chick'n wings, buffalo",193,12.1,9.29,15
gardein ultimate plant-based crispy breaded fish,"breaded plant-based fish fillets, breaded",177,10.6,9.73,12.4
morningstar farms® incogmeato homestyle plant based chik'n tenders,"chik'n plant-based tenders, chik'n",256,18.9,10,24.4
morningstar farms® incogmeato original plant based pancake and sausage on a stick,plant-based pancake & sausage on a stick,203,13,3.62,30.4
gardein ultimate plant-based vegan bbq chick'n wings,"bbq ultimate plant-based chick'n wings, bbq",200,12.1,6.43,23.6
konscious™ plant based california roll,"sushi roll, california",94,2.92,0.67,18.39
morningstar farms® pringles original flavor plant based chik'n fries,pringles original flavored plant-based chik'n fries,250,13.8,12.5,23.8
morningstar farms® incogmeato hot and spicy plant based chik'n filets,"sizzlin' spicy chik'n plant-based patties, sizzlin' spicy chik'n",197,14.1,6.34,22.5
columbus calabrese salame,"calabrese salame, calabrese",312,20.8,20.8,6.25
simulate spicy nuggs plant-based nuggets,"spicy chicken nuggs plant-based nuggets, spicy chicken",247,15.3,11.8,18.8
simple houseware vacuum sealer bags 3-pack,"sweet potato, canned, vacuum pack",382,1.65,0.2,21.1
kroger® hickory smoked bacon wrapped tenderloin filet,"hickory smoked bacon wrapped pork filet, hickory smoked",188,18.2,11.8,2.35
kroger® peppered bacon wrapped beef tenderloin filet,"peppered bacon wrapped beef tenderloin filet, peppered bacon",229,19.4,16.5,0.59
marcangelo montreal spice bacon beef skewers,bacon and beef sticks,517,29.1,32.1,0.8
beef choice back ribs,"beef, rib, back ribs, bone-in, separable lean and fat, trimmed to 0"" fat, choice, raw",336,15.8,29.9,0.9
private selection® natural angus beef brisket with salt & pepper,"angus beef brisket, angus beef",157,26.5,4.9,0.98
